{
  "version": "source-ops-task-v1",
  "taskId": "example-grading-social-001",
  "role": "grading",
  "objective": "Grade a researched social-source candidate for signal quality, corroboration value, and promotion readiness.",
  "scope": {
    "targetCategory": "social",
    "targetRegions": ["global"],
    "mustCompareAgainst": ["Bluesky", "Twitter", "GDELT"]
  },
  "io": {
    "registryPath": "source-ops/source-registry.seed.json",
    "outputPath": "source-ops/results/grading/example-grading-social-001.json"
  },
  "policy": {
    "contractMode": "file-first",
    "productionMutationsAllowed": false,
    "activePromotionRequiresHumanApproval": true
  }
}
